{"$schema":"https://json-schema.org/draft/2020-12/schema","$id":"https://schemas.agentic-workflow.local/apps_rg/shadow_canary_promotion.v1.schema.json","type":"object","additionalProperties":false,"required":["schema_version","monitor_id","status","qualification_identity","observed_identity","slo","observation","rollback_rehearsal","promotion_authority"],"properties":{"schema_version":{"const":"apps_rg.shadow_canary_promotion.v1"},"monitor_id":{"type":"string","minLength":1},"status":{"enum":["PENDING","COMPLETE"]},"qualification_identity":{"type":["object","null"]},"observed_identity":{"type":["object","null"]},"slo":{"type":"object"},"observation":{"type":["object","null"]},"rollback_rehearsal":{"type":["object","null"]},"promotion_authority":{"type":"object"}}}
