{"schema_version":"apps_rg.shadow_canary_promotion.v1","monitor_id":"apps_rg_v2_w8_shadow_canary","status":"PENDING","qualification_identity":null,"observed_identity":null,"slo":{"minimum_request_count":null,"minimum_observation_window_seconds":null,"candidate_error_rate_delta_max":null,"candidate_p95_latency_ratio_max":null,"cost_per_completed_resume_max":null,"stage_failure_rate_max":null,"p1_proxy_delta_min":null,"p2_proxy_delta_min":null,"distribution_drift_max":null,"reviewer_disagreement_max":null},"observation":null,"rollback_rehearsal":null,"promotion_authority":{"status":"NOT_SUPPLIED"}}
